{
  "id": "receipt-demo-001",
  "intent_id": "intent-demo-001",
  "observed_at": "2026-09-25T10:02:00Z",
  "kind": "employer_confirmation_page",
  "source_origin": "https://employer.example.invalid",
  "application_reference": "DEMO-101-REF",
  "evidence_sha256": "5555555555555555555555555555555555555555555555555555555555555555",
  "verification_status": "qualified",
  "redacted": true
}